{"type":"config","name":"cap-fix-artifact-removal","metricName":"artifact_rise_eV","metricUnit":"eV","bestDirection":"lower","noiseFloor":0.1,"maxRuns":24,"maxSeconds":null,"targetMetric":0.1,"startedAt":1783949394}
{"run":1,"commit":"8f3650f","metric":23.494675,"metrics":{"excursion_eV":0.109789,"drain_eV":-23.384886,"absorbed_e":0.870879,"t_min_au":21.6},"status":"keep","description":"baseline: two-sided eta=-0.2 c32.5 w15 (reproduces diagnosis bit-identically)","timestamp":1783952892,"segment":0}
{"run":2,"commit":"8f3650f","metric":35.338369,"metrics":{"excursion_eV":1.902728,"drain_eV":-33.435641,"absorbed_e":0.876,"t_min_au":22.0},"status":"discard","description":"draft wrap-around equal-integral twin (eta=-0.2 w30): WORSE — topology arm refuted","timestamp":1783952892,"segment":0}
{"run":3,"commit":"8f3650f","metric":0.000000,"metrics":{"excursion_eV":0.0,"drain_eV":-153.216108,"absorbed_e":0.999825,"t_min_au":28.0},"status":"keep","description":"draft strong-CAP two-sided eta=-2.0: MONOTONE, whole WP absorbed (0.9998e) — screening target reached; 950-step confirmation launched","timestamp":1783956782,"segment":0}
{"run":4,"commit":"8f3650f","metric":24.376709,"metrics":{"excursion_eV":2.631039,"drain_eV":-21.745669,"absorbed_e":0.754986,"t_min_au":21.6},"status":"discard","description":"draft pushed-out footprint (eta=-0.2 c35 w10): rise ~= baseline, excursion WORSE (2.63 eV), absorption down to 0.755 — footprint arm fails at weak eta","timestamp":1783957442,"segment":0}
{"type":"config","name":"cap-fix-confirmation-950","metricName":"artifact_rise_eV","metricUnit":"eV","bestDirection":"lower","noiseFloor":0.1,"maxRuns":12,"maxSeconds":null,"targetMetric":0.1,"startedAt":1783964741}
{"run":5,"commit":"8f3650f","metric":3.500102,"metrics":{"excursion_eV":0.0,"drain_eV":-167.018618,"absorbed_e":1.000814,"t_min_au":33.8},"status":"keep","description":"segment-1 baseline: eta=-2.0 @950 (t=38): excursion 0.000 (never above ref), residual late rise 3.50 eV from min t=33.8; whole WP + some spill absorbed (1.0008e)","timestamp":1783964741,"segment":1}
{"run":6,"commit":"8f3650f","metric":169.323703,"metrics":{"excursion_eV":31.272362,"drain_eV":-138.051341,"absorbed_e":1.000507,"t_min_au":27.8},"status":"discard","description":"positive control eta=-1.0 @950 (partial, t=36, timeout 124 at step 904 after 21 s/step slowdown): rise 169.3, excursion +31.27 eV — REPRODUCES phase-0 (+31.3); confirmation window VALIDATED","timestamp":1783964741,"segment":1}
{"run":8,"commit":"8f3650f","metric":24.655379,"metrics":{"excursion_eV":0.0,"drain_eV":-158.602106,"absorbed_e":1.000049,"t_min_au":33.8},"status":"discard","description":"cross strong-eta x pushed footprint (eta=-2 c35 w10 @950): residual rise 24.66 eV — 7x WORSE than run 5; narrower/outer CAP feeds the late rebound (reflection/slosh); standard footprint stays best","timestamp":1783969730,"segment":1}
{"run":7,"commit":"8f3650f","metric":20.211027,"metrics":{"excursion_eV":0.0,"drain_eV":-164.732443,"absorbed_e":1.000929,"t_min_au":32.2},"status":"discard","description":"eta ladder -4.0 @950: residual rise 20.21 eV — WORSE than eta=-2 (3.50). eta ladder has an OPTIMUM in (-1,-4): weak transmits+nibbles, strong REFLECTS slow spill. Bracketing with eta=-3.","timestamp":1783969910,"segment":1}
{"run":9,"commit":"8f3650f","metric":0.324044,"metrics":{"excursion_eV":0.0,"drain_eV":-168.339801,"absorbed_e":1.000518,"t_min_au":36.4},"status":"keep","description":"cross wrap x eta=-2.0 (w30) @950: rise 0.324 eV — 10x better than two-sided eta=-2; NEW BEST. Wrap plugs the two-sided W=0 boundary hole where slow spill leaks/lingers; at strong eta topology now HELPS","timestamp":1783973168,"segment":1}
{"run":10,"commit":"8f3650f","metric":11.832012,"metrics":{"excursion_eV":0.0,"drain_eV":-165.694611,"absorbed_e":1.000885,"t_min_au":32.8},"status":"discard","description":"two-sided eta=-3.0 @950: rise 11.83 eV — ladder now convex (169/3.5/11.8/20.2 at -1/-2/-3/-4), optimum eta~-2 still 10x worse than wrap. TWO-SIDED ARM CLOSED.","timestamp":1783974282,"segment":1}
{"run":11,"commit":"8f3650f","metric":0.000000,"metrics":{"excursion_eV":0.0,"drain_eV":-178.308846,"absorbed_e":1.014951,"t_min_au":38.0},"status":"keep","description":"wrap eta=-2.0 WIDTH 40 @950: rise 0.000000 — STRICTLY MONOTONE to t=38 (t_min=end). TARGET REACHED. Caveat: absorbed 1.015e (|z|>20 footprint nibbles static slab tail ~0.015e over t=38). 1200-step hardening launched.","timestamp":1783976629,"segment":1}
{"run":12,"commit":"db1b7b6","metric":8.594612,"metrics":{"excursion_eV":0.0,"drain_eV":-163.444085,"absorbed_e":1.000455,"t_min_au":34.4},"status":"discard","description":"wrap eta=-1.5 w30 @950: rise 8.59 eV — wrap ladder also wants eta>=-2 (gentler-strength hypothesis fails); winner unchallenged","timestamp":1783978341,"segment":1}
{"run":13,"commit":"db1b7b6","metric":0.000000,"metrics":{"excursion_eV":0.0,"drain_eV":-192.03347,"absorbed_e":1.020007,"t_min_au":48.0},"status":"keep","description":"HARDENING: winner (wrap eta=-2 w40) @1200 steps t=48: rise 0.000000, monotone to the final step, 12 au past the riser era. Slab-tail nibble continues slowly (absorbed 1.020e, ~5e-4 e/au).","timestamp":1783980953,"segment":1}
{"run":14,"commit":"db1b7b6","metric":0.000000,"metrics":{"excursion_eV":0.015566,"drain_eV":-32.478678,"absorbed_e":0.795589,"t_min_au":38.0},"status":"keep","description":"TRANSFERABILITY: winner at HALF WP speed (K0 2.8465) @950: rise 0.000000, monotone to end; early excursion 0.0156 eV (bound-tail nibble pre-arrival, 6x below noise floor); absorbed 0.796e (slower transit). Winner holds across velocity. CAMPAIGN TARGET COMPLETE.","timestamp":1783982190,"segment":1}
